id,code_bc,name,short_name,bic,country:id,ispb_number,compe_member,acc_number_format
res_bank_231,746,Banco Modal S.A.,BCO MODAL S.A.,,base.br,30723886,1,%(acc_number)s
res_bank_232,747,Banco Rabobank International Brasil S.A.,BCO RABOBANK INTL BRASIL S.A.,,base.br,1023570,1,%(acc_number)s
res_bank_233,748,BANCO COOPERATIVO SICREDI S.A.,BCO COOPERATIVO SICREDI S.A.,BCSIBRRS,base.br,1181521,1,%(acc_number)s
res_bank_234,751,Scotiabank Brasil S.A. Banco Múltiplo,SCOTIABANK BRASIL,,base.br,29030467,0,%(acc_number)s
res_bank_235,752,Banco BNP Paribas Brasil S.A.,BCO BNP PARIBAS BRASIL S A,,base.br,1522368,1,%(acc_number)s
res_bank_236,753,Novo Banco Continental S.A. - Banco Múltiplo,NOVO BCO CONTINENTAL S.A. - BM,,base.br,74828799,1,%(acc_number)s
res_bank_237,754,Banco Sistema S.A.,BANCO SISTEMA,,base.br,76543115,0,%(acc_number)s
res_bank_238,755,Bank of America Merrill Lynch Banco Múltiplo S.A.,BOFA MERRILL LYNCH BM S.A.,,base.br,62073200,1,%(acc_number)s
res_bank_239,756,BANCO COOPERATIVO DO BRASIL S.A. - BANCOOB,BANCOOB,,base.br,2038232,1,%(acc_number)s
res_bank_240,757,BANCO KEB HANA DO BRASIL S.A.,BCO KEB HANA DO BRASIL S.A.,,base.br,2318507,1,%(acc_number)s
